,Title,Price,Sponsored,Discount,Link
0,"MELA MELA Non-Slip Yoga Mat for Home Gym - 6mm Thick, Eco-Friendly TPE, Cushioned Exercise Mat with Carry Strap - Perfect for Yoga, Pilates, Fitness Training, & Gymnastics Essentials - Beige ",79.90,Yes,32% Off,/uae-en/mela-non-slip-yoga-mat-for-home-gym-6mm-thick-eco-friendly-tpe-cushioned-exercise-mat-with-carry-strap-perfect-for-yoga-pilates-fitness-training-gymnastics-essentials-beige/ZECB29782C8C4BD506B8EZ/p/?o=zecb29782c8c4bd506b8ez-1
1,"TYCOM Tycom Resistance Loop Bands- Resistance Exercise Bands Set Workout Bands Flex bands for Home Fitness, Stretching, Strength Training, Physical Therapy, Yoga ",28.90,Yes,41% Off,/uae-en/tycom-resistance-loop-bands-resistance-exercise-bands-set-workout-bands-flex-bands-for-home-fitness-stretching-strength-training-physical-therapy-yoga/ZE5D7520215AA49D4ED49Z/p/?o=ze5d7520215aa49d4ed49z-1
2,Maston Yoga Pilates Ring Fitness Magic Circle Wrap Slimming Body Building Fitness Accessories foamroller ,35,Yes,10% Off,/uae-en/yoga-pilates-ring-fitness-magic-circle-wrap-slimming-body-building-fitness-accessories-foamroller/Z532ED4BF3B873929AEF6Z/p/?o=z532ed4bf3b873929aef6z-1
3,Generic Anti-Tear Exercise Mat With Carrying Strap ,34.70,No,85% Off,/uae-en/anti-tear-exercise-mat-with-carrying-strap/N20034893A/p/?o=d6f1ea275e88dc5d
4,"Unique 3Pcs Resistance Bands、Leg Exercise Bands, 3 Levels Elastic Stretch Loops Wide Booty Fitness Bands Workout Resistance Bands Muscle Toning Bands Resistance Bands Set for Women Legs, Yoga Starter Set ",29.20,No,58% Off,/uae-en/3pcs-resistance-bands-leg-exercise-bands-3-levels-elastic-stretch-loops-wide-booty-fitness-bands-workout-resistance-bands-muscle-toning-bands-resistance-bands-set-for-women-legs-yoga-starter-set/Z03243B45FABF17EDBE8DZ/p/?o=z03243b45fabf17edbe8dz-1
5,"MahMir Mahmir® EVA Foam Roller for Yoga, Deep Tissue Massage, Stretching, Physical Therapy, Relieve Stress, Improve Mobility with Foam Roller for Legs and Muscles - Deep Tissue Massage Tool (Light Blue) ",29.95,Yes,,/uae-en/mahmir-eva-foam-roller-for-yoga-deep-tissue-massage-stretching-physical-therapy-relieve-stress-improve-mobility-with-foam-roller-for-legs-and-muscles-deep-tissue-massage-tool-light-blue/Z1FFBA90CF03B4E1CDF5CZ/p/?o=z1ffba90cf03b4e1cdf5cz-1
6,Generic Extra Thick High Density Anti-Tear Exercise Yoga Mat ,29,Yes,95% Off,/uae-en/extra-thick-high-density-anti-tear-exercise-yoga-mat/Z6AA422C01041A12BF086Z/p/?o=z6aa422c01041a12bf086z-1
7,Generic Adjustable Anti-Gravity Home Aerial Yoga Hammock Swing Trapeze Inversion Tool 250*150cm ,182,Yes,65% Off,/uae-en/adjustable-anti-gravity-home-aerial-yoga-hammock-swing-trapeze-inversion-tool-250-150cm/N42326497A/p/?o=bb0af8063147934d
8,ZCM-HAPPY 2 Piece Yoga Block Props Brick ,25,No,,/uae-en/2-piece-yoga-block-props-brick/Z712491AD789D5E234AE5Z/p/?o=z712491ad789d5e234ae5z-1
9,SkyLand Anti-Skid Yoga Mat 6 mm - Purple 61 X  13 X 13cm ,55,No,20% Off,/uae-en/anti-skid-yoga-mat-6-mm-purple-61-x-13-x-13cm/N35881030A/p/?o=ae4242abc0c8718a
10,Fitness World Yoga Ball 65cm ,30.05,No,9% Off,/uae-en/yoga-ball-65cm/N18842285A/p/?o=d5fb2d434e76aacc
11,SYOSI Resistance Bands Professional Exercise Bands Long Natural Latex Elastic Bands ,32.70,No,,/uae-en/resistance-bands-professional-exercise-bands-long-natural-latex-elastic-bands/Z05402886C913AB3EEB09Z/p/?o=e49140bbbf45dedc
12,UKR UKR Tri-Fold Portable Non-Slip Yoga Mat Fitness Mat Gym Mat Travel Exercise Training Aerobic Mat Fitness Gym & Gymnastics Balance Padded Mat Blue (183x61x2.2 cm) ,109.95,No,10% Off,/uae-en/ukr-tri-fold-portable-non-slip-yoga-mat-fitness-mat-gym-mat-travel-exercise-training-aerobic-mat-fitness-gym-gymnastics-balance-padded-mat-blue-183x61x2-2-cm/Z274EF3F6E0CF52B104EEZ/p/?o=z274ef3f6e0cf52b104eez-1
13,"MahMir Mahmir® EVA Foam Roller for Yoga, Deep Tissue Massage, Stretching, Physical Therapy, Relieve Stress, Improve Mobility with Foam Roller for Legs and Muscles - Deep Tissue Massage Tool (Pink) ",29.95,Yes,,/uae-en/mahmir-eva-foam-roller-for-yoga-deep-tissue-massage-stretching-physical-therapy-relieve-stress-improve-mobility-with-foam-roller-for-legs-and-muscles-deep-tissue-massage-tool-pink/Z30868C98E61D2ABA2621Z/p/?o=z30868c98e61d2aba2621z-1
14,"Generic Multicolor Anti-Slip Fitness Exercise Gym Yoga Mats - 4mm Thick, 61x173cm, for Indoor and Outdoor Use ",34.30,Yes,42% Off,/uae-en/multicolor-anti-slip-fitness-exercise-gym-yoga-mats-4mm-thick-61x173cm-for-indoor-and-outdoor-use/Z4309655FA88AC7B8A209Z/p/?o=z4309655fa88ac7b8a209z-1
15,"WAOKN 5 PCS Different Colors of Resistance Band for Leg Hip And Hip Strength Training Yoga Stretch Elastic Band,Fitness Elastic and Tension Band,Yoga Products in Home Gym Outdoors ",36.65,No,57% Off,/uae-en/5-pcs-different-colors-of-resistance-band-for-leg-hip-and-hip-strength-training-yoga-stretch-elastic-band-fitness-elastic-and-tension-band-yoga-products-in-home-gym-outdoors/Z4521303BE3EA2B4B2A22Z/p/?o=z4521303be3ea2b4b2a22z-1
16,Inder Yoga Sticks Training for Posture Corrector Humpback Correction Stick Yoga Open Back Men Women Posture Trainer Corrector ,24.35,No,37% Off,/uae-en/yoga-sticks-training-for-posture-corrector-humpback-correction-stick-yoga-open-back-men-women-posture-trainer-corrector/Z1BA7F8A85269F90D7440Z/p/?o=z1ba7f8a85269f90d7440z-1
17,"Spall Yoga Mat Non Slip,Yoga Mat with Strap Included 10mm Thick Exercise Mat Yoga and Many Other Home Workouts ",38.50,No,51% Off,/uae-en/yoga-mat-non-slip-yoga-mat-with-strap-included-10mm-thick-exercise-mat-yoga-and-many-other-home-workouts/ZC6C9145A3D25DF55B11AZ/p/?o=zc6c9145a3d25df55b11az-1
18,Y&D Yoga Barre Socks Non Slip Anti Skid Sticky Silicone Grips Cotton for Pilates Gym Pure Ballet Dance Barefoot Workout Ankle Multiuse Black Grey Skin Color 3Pcs ,50,No,27% Off,/uae-en/yoga-barre-socks-non-slip-anti-skid-sticky-silicone-grips-cotton-for-pilates-gym-pure-ballet-dance-barefoot-workout-ankle-multiuse-black-grey-skin-color-3pcs/Z2F9046D53376D3F6A8B7Z/p/?o=z2f9046d53376d3f6a8b7z-1
19,BOLDFIT Durable and Comfy Texture Yoga Belt Strap For Stretching with Extra Safe Adjustable D-Ring Buckle ,39,No,33% Off,/uae-en/durable-and-comfy-texture-yoga-belt-strap-for-stretching-with-extra-safe-adjustable-d-ring-buckle/ZB9CDE67D0E9D26CAE10DZ/p/?o=zb9cde67d0e9d26cae10dz-1
20,GROIC 5Kg SandBell Sandbag Filled Exercise Pattern Workout Bag Use at Home Gym Equipment an Anywhere Sand Bag Kettlebell Ships Pre-Filled for Fitness ,45,No,77% Off,/uae-en/5kg-sandbell-sandbag-filled-exercise-pattern-workout-bag-use-at-home-gym-equipment-an-anywhere-sand-bag-kettlebell-ships-pre-filled-for-fitness/ZCAFC184D73864AC47048Z/p/?o=bcbb5d70c1c86e0d
21,321 STRONG Massage Foam Roller ,37.05,No,,/uae-en/massage-foam-roller/N34146072A/p/?o=a92a320a68a7204c
22,"Bernessi 8MM Yoga Mat with Carrying Strap Anti-Slip for Home Workout Exercises Meditation Eco Friendly, Non Skid TPE Yoga Mattres for Pilates 183x61x0.8cm Thick, Pink/Black Color ",69.90,Yes,57% Off,/uae-en/8mm-yoga-mat-with-carrying-strap-anti-slip-for-home-workout-exercises-meditation-eco-friendly-non-skid-tpe-yoga-mattres-for-pilates-183x61x0-8cm-thick-pink-black-color/Z24E1B5B4FDE8BB5C6111Z/p/?o=z24e1b5b4fde8bb5c6111z-1
23,"URbazaar Yoga Mat for Women and Men, Extra Long and Wide Exercise Mat(72""x24""), Large Non Slip Workout Mat for Yoga, Pilates, Fitness, Barefoot Workouts, Home Gym Studio ",54.90,Yes,8% Off,/uae-en/yoga-mat-for-women-and-men-extra-long-and-wide-exercise-mat-72-x24-large-non-slip-workout-mat-for-yoga-pilates-fitness-barefoot-workouts-home-gym-studio/Z603FF8FD1BFB572D8D9FZ/p/?o=z603ff8fd1bfb572d8d9fz-1
24,ORiTi Stretch Strap with Exercise Guide Versatile Multi-Loop Perfect for Yoga Pilates and Physical Therapy Portable Helps Improve Flexibility ,28,Yes,,/uae-en/stretch-strap-with-exercise-guide-versatile-multi-loop-perfect-for-yoga-pilates-and-physical-therapy-portable-helps-improve-flexibility/Z184FBC1B30D0C5DACA2DZ/p/?o=z184fbc1b30d0c5daca2dz-1
25,Spall Yoga Mats Anti-slip Sport Fitness Mat Blanket For Exercise Yoga And Pilates Gymnastics Mat Fitness Equipment 6mm ,37,No,26% Off,/uae-en/yoga-mats-anti-slip-sport-fitness-mat-blanket-for-exercise-yoga-and-pilates-gymnastics-mat-fitness-equipment-6mm/Z0E37FFB9B21AC2C9297CZ/p/?o=z0e37ffb9b21ac2c9297cz-1
26,Spall Yoga Mats Anti-slip Sport Fitness Mat Blanket For Exercise Yoga And Pilates Gymnastics Mat Fitness Equipment 6mm ,37,No,26% Off,/uae-en/yoga-mats-anti-slip-sport-fitness-mat-blanket-for-exercise-yoga-and-pilates-gymnastics-mat-fitness-equipment-6mm/Z131EFE3A0A418553788CZ/p/?o=z131efe3a0a418553788cz-1
27,Motim Yoga Foam Bricks Fitness Equinment Block 9 x 6 x 3cm ,24.45,No,,/uae-en/yoga-foam-bricks-fitness-equinment-block-9-x-6-x-3cm/N30116717A/p/?o=ef82480bd4a1649f
28,ZCM-HAPPY Yoga Fitness Exercise Ball With Air Pump 75cm ,33,No,,/uae-en/yoga-fitness-exercise-ball-with-air-pump-75cm/ZAD8031CED5EAB0061F80Z/p/?o=zad8031ced5eab0061f80z-1
29,"GROIC Ab Roller for Abs Workout, Pilates Bar Kit with Resistance Band Set, Exercise Bar with AB Roller, Yoga Stretching Equipment, Core Strength Training Equipment, Portable Home Gym for Men and Women ",104.35,No,47% Off,/uae-en/ab-roller-for-abs-workout-pilates-bar-kit-with-resistance-band-set-exercise-bar-with-ab-roller-yoga-stretching-equipment-core-strength-training-equipment-portable-home-gym-for-men-and-women/Z537AAA58F5ED089134C9Z/p/?o=z537aaa58f5ed089134c9z-1
30,QiaoKai Pilates And Yoga Rubber Resistance Band ,18.75,No,,/uae-en/pilates-and-yoga-rubber-resistance-band/N15686964A/p/?o=fab8abbb78d9beab
31,Fitness World Exercise Swiss Ball 75cm ,30.05,No,20% Off,/uae-en/exercise-swiss-ball-75cm/N16660086A/p/?o=d2973e7b4167d33b
32,N.E.A.T by nicky Unisex TPE Yoga Mat 183*61*0.5cm ,169,No,,/uae-en/unisex-tpe-yoga-mat-183-61-0-5cm/N51822224A/p/?o=f345a87462a35f5f
33,"Spall Yoga Mat Non Slip,Yoga Mat with Strap Included 10mm Thick Exercise Mat Yoga and Many Other Home Workouts ",35,No,56% Off,/uae-en/yoga-mat-non-slip-yoga-mat-with-strap-included-10mm-thick-exercise-mat-yoga-and-many-other-home-workouts/Z827B6D6A8D67451C7F79Z/p/?o=z827b6d6a8d67451c7f79z-1
34,Adidas Fitness Mat - 10Mm - Dark Green ,142.30,No,8% Off,/uae-en/fitness-mat-10mm-dark-green/Z8E2E75E9B01F70A5C6DAZ/p/?o=z8e2e75e9b01f70a5c6daz-1
35,Gaiam 6Mm  Premium Mandala Yoga Mat ,52,No,68% Off,/uae-en/6mm-premium-mandala-yoga-mat/Z25D4BDA82C9769BF5FBBZ/p/?o=z25d4bda82c9769bf5fbbz-1
36,Toshionics Anti Slip Fitness Exercise Gym Yoga Mats 4mm Thick For indoor And Outdoor 61x173cm Multicolor ,31.75,No,47% Off,/uae-en/anti-slip-fitness-exercise-gym-yoga-mats-4mm-thick-for-indoor-and-outdoor-61x173cm-multicolor/ZFF6D1886AAD421874DF1Z/p/?o=zff6d1886aad421874df1z-1
37,ZCM-HAPPY 2 Piece Yoga Block Props Brick ,25,No,,/uae-en/2-piece-yoga-block-props-brick/Z788232ABE3508B6DF27EZ/p/?o=z788232abe3508b6df27ez-1
38,"GROIC 4 in 1 Yoga Roller Set Trigger Point Yoga Roller, Massage Roller Stick, Massage Ball, for Deep Stretching Muscle Massage Pilates Yoga, Fitness Exercise for Whole Body Release ",80.25,No,59% Off,/uae-en/4-in-1-yoga-roller-set-trigger-point-yoga-roller-massage-roller-stick-massage-ball-for-deep-stretching-muscle-massage-pilates-yoga-fitness-exercise-for-whole-body-release/ZE9AB84A227A954972F0EZ/p/?o=ze9ab84a227a954972f0ez-1
39,Body Builder Body Builder Yoga Roller 42x14x14cm ,27.40,No,27% Off,/uae-en/body-builder-yoga-roller-42x14x14cm/N38544352A/p/?o=cc0cf21e314b206d
40,SkyLand Unisex Comfortable and Extra Protection Anti-Skid TPE Yoga Mat 61*183cm ,55,No,,/uae-en/unisex-comfortable-and-extra-protection-anti-skid-tpe-yoga-mat-61-183cm/N35881029A/p/?o=b96b6e771577d99d
41,Manduka Prolite Yoga Mat Indulge 71 Inch ,490,No,,/uae-en/prolite-yoga-mat-indulge-71-inch/ZAAF4543ABA27716CF7AFZ/p/?o=zaaf4543aba27716cf7afz-1
42,Toshionics Anti Slip Fitness Exercise Gym Yoga Mats 4mm Thick For indoor And Outdoor 61x173cm ,31.25,Yes,47% Off,/uae-en/anti-slip-fitness-exercise-gym-yoga-mats-4mm-thick-for-indoor-and-outdoor-61x173cm/ZE5D98E2FD55A24417BE7Z/p/?o=ze5d98e2fd55a24417be7z-1
43,Maston 46cm Wave Speed Ball Yoga Semi-Circular Balance Ball Fitness Pilates Ball (Blue Pattern) ,169,Yes,,/uae-en/46cm-wave-speed-ball-yoga-semi-circular-balance-ball-fitness-pilates-ball-blue-pattern/Z4F463B171B59F7A9E19BZ/p/?o=z4f463b171b59f7a9e19bz-1
44,"Generic Anti-Slip Fitness Exercise Gym Yoga Mats - 4mm Thick, 61x173cm, for Indoor and Outdoor Use ",37.55,Yes,37% Off,/uae-en/anti-slip-fitness-exercise-gym-yoga-mats-4mm-thick-61x173cm-for-indoor-and-outdoor-use/Z5556A4895CC44B536812Z/p/?o=z5556a4895cc44b536812z-1
45,"GROIC Lifting Leggings for Woman,High Waisted Seamless Yoga Compression Pants Gym Workout Tights,Fitness Pants ",79.20,No,,/uae-en/lifting-leggings-for-woman-high-waisted-seamless-yoga-compression-pants-gym-workout-tights-fitness-pants/Z99E39156A28E9886EBE3Z/p/?o=z99e39156a28e9886ebe3z-1
46,"Yalla HomeGym YALLA HomeGym 30MM EXTRA THICK Rubber Heavy-Duty Gym Floor Mat, Commercial Gym Rubber Floor Tiles Shock Absorbing 1 Squared Meter (BLACK) ",270,No,,/uae-en/yalla-homegym-30mm-extra-thick-rubber-heavy-duty-gym-floor-mat-commercial-gym-rubber-floor-tiles-shock-absorbing-1-squared-meter-black/ZE7C9F6AC8E92A3443C39Z/p/?o=ze7c9f6ac8e92a3443c39z-1
47,"GROIC 5 in 1 Foam Roller Set for Deep Tissue Muscle Massage, Trigger Point Fitness Exercise Foam Roller, Massage Roller, Massage Ball, Stretching Strap, for Whole Body ",94,No,53% Off,/uae-en/5-in-1-foam-roller-set-for-deep-tissue-muscle-massage-trigger-point-fitness-exercise-foam-roller-massage-roller-massage-ball-stretching-strap-for-whole-body/ZA3DED90B9E16F14E8ED0Z/p/?o=za3ded90b9e16f14e8ed0z-1
48,Kanteen Store Anti Burst Sports Swiss Yoga Aerobic Body Fitness Ball 65cm ,32,No,27% Off,/uae-en/anti-burst-sports-swiss-yoga-aerobic-body-fitness-ball-65cm/N22815219A/p/?o=ecdeba83617ac31e
49,yoga mat Foldable Non-Slip Yoga Mat ,37.85,No,,/uae-en/foldable-non-slip-yoga-mat/N34539048A/p/?o=a43345d3b1072ded
50,"DeloPik 2PCS 20x20cm Yoga Knee Pad, Anti Slip Foam, Comfortable Yoga Support Pad, Sports Balance Cushion for Protecting Knee, Ankle, Elbow, Hand ",29,No,,/uae-en/2pcs-20x20cm-yoga-knee-pad-anti-slip-foam-comfortable-yoga-support-pad-sports-balance-cushion-for-protecting-knee-ankle-elbow-hand/Z6FAF67B9A2FACEF545D4Z/p/?o=z6faf67b9a2facef545d4z-1
51,Maston Yoga Pilates Ring Fitness Magic Circle Wrap Slimming Body Building Fitness Accessories foamroller ,35,No,10% Off,/uae-en/yoga-pilates-ring-fitness-magic-circle-wrap-slimming-body-building-fitness-accessories-foamroller/Z532ED4BF3B873929AEF6Z/p/?o=z532ed4bf3b873929aef6z-1
52,"SYOSI Peanut Ball, Exercise Yoga Balance Stability Sitting Anti Burst Ball for Labor Birthing, Kids Sensory Toys, Home & Gym Fintness, Include Pump Strap ",81.95,No,,/uae-en/peanut-ball-exercise-yoga-balance-stability-sitting-anti-burst-ball-for-labor-birthing-kids-sensory-toys-home-gym-fintness-include-pump-strap/ZB3BECB6C88EAD33289D6Z/p/?o=zb3becb6c88ead33289d6z-1
53,BODY SCULPTURE Anti-Burst Gymball 30inch ,65.65,No,30% Off,/uae-en/anti-burst-gymball-30inch/N16241886A/p/?o=c0e12db586759f2b
54,"GROIC Pilates Bar Kit with Resistance Bands(6 x Resistance Bands),3-Section Pilates Bar with Stackable Bands Workout Equipment for Legs,Hip,Waist and Arm,Exercise Fitness Equipment for Adult ",92.90,No,53% Off,/uae-en/pilates-bar-kit-with-resistance-bands-6-x-resistance-bands-3-section-pilates-bar-with-stackable-bands-workout-equipment-for-legs-hip-waist-and-arm-exercise-fitness-equipment-for-adult/ZD8EDDD325573EC7B2A21Z/p/?o=zd8eddd325573ec7b2a21z-1
55,RIOXS 5 Pairs Yoga Socks For Women Non-Slip Grips & Straps Non Slip Socks For Yoga Pilates Ideal For Pilates Ballet Dance Barefoot Workout ,46.05,No,53% Off,/uae-en/5-pairs-yoga-socks-for-women-non-slip-grips-straps-non-slip-socks-for-yoga-pilates-ideal-for-pilates-ballet-dance-barefoot-workout/Z288231EEFD4008FE0C11Z/p/?o=z288231eefd4008fe0c11z-1
56,Fitness World Pair Of Sand Weight Bag 3kg ,25.25,No,39% Off,/uae-en/pair-of-sand-weight-bag-3kg/N16660112A/p/?o=a009419ac94a76ae
57,SHAPE UP Quick Dry Microfiber Absorbent Towel Set of L+S Buttoned Loop with Pouch Compact Lightweight Antibacterial for Beach Travel Camping Gym Workout Sports Yoga Fitness Hiking with ShapeUp Brand Keychain ,84,No,23% Off,/uae-en/quick-dry-microfiber-absorbent-towel-set-of-l-s-buttoned-loop-with-pouch-compact-lightweight-antibacterial-for-beach-travel-camping-gym-workout-sports-yoga-fitness-hiking-with-shapeup-brand-keychain/ZDF70489150C22B11DC1CZ/p/?o=zdf70489150c22b11dc1cz-1
58,"GROIC Waist Twist Board, Fitness Waist Twist Plate, Body Sculpting Waist Twist Machine Turntable, Aerobic Fitness Equipment, Exercise Balance Board, Abdominal Muscle Training Board, Sports Equipment ",58.85,No,70% Off,/uae-en/waist-twist-board-fitness-waist-twist-plate-body-sculpting-waist-twist-machine-turntable-aerobic-fitness-equipment-exercise-balance-board-abdominal-muscle-training-board-sports-equipment/ZD289F6BF478600EE2058Z/p/?o=zd289f6bf478600ee2058z-1
59,Vitacelli Facial Neck Lifting Machine White ,50,No,41% Off,/uae-en/facial-neck-lifting-machine-white/Z240D8A40A030A377C5B9Z/p/?o=z240d8a40a030a377c5b9z-1
60,DBLEW Professional 7mm Thick Anti Fatigue Yoga Mat Knees Supportive Anti Slip Fitness Home Exercise EVA Eco Friendly Ideal For All Types Of Pilates Floor ABS Belly Tummy Fat Workouts Gym Stretching 90x190cm ,38.90,No,61% Off,/uae-en/professional-7mm-thick-anti-fatigue-yoga-mat-knees-supportive-anti-slip-fitness-home-exercise-eva-eco-friendly-ideal-for-all-types-of-pilates-floor-abs-belly-tummy-fat-workouts-gym-stretching-90x190cm/ZC4C03318E131D261B483Z/p/?o=zc4c03318e131d261b483z-1
61,"Tchibo Yoga Balance Pad, Blue ",62.95,No,,/uae-en/yoga-balance-pad-blue/Z6D02C944FF98B1862843Z/p/?o=z6d02c944ff98b1862843z-1
62,"umbro 3 Piece Brand Logo Stretch Brand, Blue ",63.95,No,,/uae-en/3-piece-brand-logo-stretch-brand-blue/Z229A3BBBDD746BBBB4B7Z/p/?o=z229a3bbbdd746bbbb4b7z-1
63,"Gerenic Yoga Balance Wheel, 18.5cm/7.3in Width Yoga Balance Circle, Yoga Prop Wheel for Yoga Poses Increasing Flexibility, Yoga Stretching Wheel Non Slip, Perfect Yoga Prop for Beginner ",133,No,,/uae-en/yoga-balance-wheel-18-5cm-7-3in-width-yoga-balance-circle-yoga-prop-wheel-for-yoga-poses-increasing-flexibility-yoga-stretching-wheel-non-slip-perfect-yoga-prop-for-beginner/ZB7ECA0F54587EF32E924Z/p/?o=zb7eca0f54587ef32e924z-1
